root@lamp-ubuntu-s-1vcpu-1gb-tor1-01:~# tcpdump -i eth0 dst 162.219.54.2 -c 5
tcpdump: verbose output suppressed, use -v or -vv for full protocol decode
listening on eth0, link-type EN10MB (Ethernet), capture size 262144 bytes
09:50:50.818716 IP 134.122.37.253.ssh > cpef81d0f81b843-cmf81d0f81b840.cpe.net.fido.ca.61270: Flags [P.], seq 4261107372:4261107480, ack 2397472550, win 501, length 108
09:50:50.818837 IP 134.122.37.253.ssh > cpef81d0f81b843-cmf81d0f81b840.cpe.net.fido.ca.61270: Flags [P.], seq 108:144, ack 1, win 501, length 36
09:50:50.818943 IP 134.122.37.253.ssh > cpef81d0f81b843-cmf81d0f81b840.cpe.net.fido.ca.61270: Flags [P.], seq 144:252, ack 1, win 501, length 108
09:50:50.819036 IP 134.122.37.253.ssh > cpef81d0f81b843-cmf81d0f81b840.cpe.net.fido.ca.61270: Flags [P.], seq 252:288, ack 1, win 501, length 36
09:50:50.862189 IP 134.122.37.253.ssh > cpef81d0f81b843-cmf81d0f81b840.cpe.net.fido.ca.61270: Flags [P.], seq 288:492, ack 1, win 501, length 204
5 packets captured
13 packets received by filter
0 packets dropped by kernel