root@lamp-ubuntu-s-1vcpu-1gb-tor1-01:~# tcpdump -r 0001.pcap
reading from file 0001.pcap, link-type EN10MB (Ethernet)
07:08:43.720594 IP 142.93.146.62.ssh > 99.225.113.199.54194: Flags [P.], seq 3337601368:3337601412, ack 2864540135, win 501, length 44
07:08:43.720803 IP 142.93.146.62.ssh > 99.225.113.199.54194: Flags [P.], seq 44:152, ack 1, win 501, length 108
07:08:43.721000 IP 142.93.146.62.ssh > 99.225.113.199.54194: Flags [P.], seq 152:188, ack 1, win 501, length 36
07:08:43.731182 IP 142.93.146.62.ssh > 45.93.201.115.55051: Flags [P.], seq 487860680:487860760, ack 471702840, win 501, length 80
07:08:43.732128 IP 99.225.113.199.54194 > 142.93.146.62.ssh: Flags [.], ack 188, win 4877, length 0
07:08:43.854479 IP 45.93.201.115.55051 > 142.93.146.62.ssh: Flags [R], seq 471702840, win 0, length 0
07:08:43.854558 IP 142.93.146.62 > 45.93.201.115: ICMP 142.93.146.62 tcp port ssh unreachable, length 48
07:08:43.911732 IP 121.200.61.37.58316 > 142.93.146.62.ssh: Flags [P.], seq 2469958226:2469958666, ack 4169400840, win 245, options [nop,nop,TS val 772609085 ecr 141904047], length 440
07:08:43.911827 IP 142.93.146.62.ssh > 121.200.61.37.58316: Flags [.], ack 440, win 507, options [nop,nop,TS val 141904312 ecr 772609085], length 0
07:08:44.175718 IP 121.200.61.37.58316 > 142.93.146.62.ssh: Flags [P.], seq 440:488, ack 1, win 245, options [nop,nop,TS val 772609151 ecr 141904312], length 48
07:08:44.175770 IP 142.93.146.62.ssh > 121.200.61.37.58316: Flags [.], ack 488, win 507, options [nop,nop,TS val 141904576 ecr 772609151], length 0
07:08:44.182911 IP 159.65.133.50.50434 > 142.93.146.62.ssh: Flags [S], seq 3876868440, win 64240, options [mss 1460,sackOK,TS val 3750240621 ecr 0,nop,wscale 7], length 0
