root@lamp-ubuntu-s-1vcpu-1gb-tor1-01:~#  tcpdump -i eth0
04:50:34.206416 IP 142.93.146.62.ssh > 99.225.113.199.51731: Flags [P.], seq 235484084:235484256, ack 132005, win 501, length 172
04:50:34.206518 IP 142.93.146.62.ssh > 99.225.113.199.51731: Flags [P.], seq 235484256:235484428, ack 132005, win 501, length 172
04:50:34.206603 IP 142.93.146.62.ssh > 99.225.113.199.51731: Flags [P.], seq 235484428:235484600, ack 132005, win 501, length 172
04:50:34.206689 IP 142.93.146.62.ssh > 99.225.113.199.51731: Flags [P.], seq 235484600:235484772, ack 132005, win 501, length 172
04:50:34.206788 IP 142.93.146.62.ssh > 99.225.113.199.51731: Flags [P.], seq 235484772:235484944, ack 132005, win 501, length 172
04:50:34.206894 IP 142.93.146.62.ssh > 99.225.113.199.51731: Flags [P.], seq 235484944:235485116, ack 132005, win 501, length 172
04:50:34.206979 IP 142.93.146.62.ssh > 99.225.113.199.51731: Flags [P.], seq 235485116:235485288, ack 132005, win 501, length 172
04:50:34.207102 IP 142.93.146.62.ssh > 99.225.113.199.51731: Flags [P.], seq 235485288:235485460, ack 132005, win 501, length 172
04:50:34.207202 IP 142.93.146.62.ssh > 99.225.113.199.51731: Flags [P.], seq 235485460:235485632, ack 132005, win 501, length 172
04:50:34.207299 IP 142.93.146.62.ssh > 99.225.113.199.51731: Flags [P.], seq 235485632:235485804, ack 132005, win 501, length 172
04:50:34.207392 IP 142.93.146.62.ssh > 99.225.113.199.51731: Flags [P.], seq 235485804:235485976, ack 132005, win 501, length 172
04:50:34.207494 IP 142.93.146.62.ssh > 99.225.113.199.51731: Flags [P.], seq 235485976:235486148, ack 132005, win 501, length 172
04:50:34.207597 IP 142.93.146.62.ssh > 99.225.113.199.51731: Flags [P.], seq 235486148:235486320, ack 132005, win 501, length 172
04:50:34.207696 IP 142.93.146.62.ssh > 99.225.113.199.51731: Flags [P.], seq 235486320:235486492, ack 132005, win 501, length 172
04:50:34.207797 IP 142.93.146.62.ssh > 99.225.113.199.51731: Flags [P.], seq 235486492:235486664, ack 132005, win 501, length 172
04:50:34.207900 IP 142.93.146.62.ssh > 99.225.113.199.51731: Flags [P.], seq 235486664:235486836, ack 132005, win 501, length 172
04:50:34.207998 IP 142.93.146.62.ssh > 99.225.113.199.51731: Flags [P.], seq 235486836:235487008, ack 132005, win 501, length 172
04:50:34.208091 IP 142.93.146.62.ssh > 99.225.113.199.51731: Flags [P.], seq 235487008:235487180, ack 132005, win 501, length 172
04:50:34.208187 IP 142.93.146.62.ssh > 99.225.113.199.51731: Flags [P.], seq 235487180:235487352, ack 132005, win 501, length 172
04:50:34.208310 IP 142.93.146.62.ssh > 99.225.113.199.51731: Flags [P.], seq 235487352:235487524, ack 132005, win 501, length 172
04:50:34.208425 IP 142.93.146.62.ssh > 99.225.113.199.51731: Flags [P.], seq 235487524:235487696, ack 132005, win 501, length 172
04:50:34.208537 IP 142.93.146.62.ssh > 99.225.113.199.51731: Flags [P.], seq 235487696:235487868, ack 132005, win 501, length 172
04:50:34.208636 IP 142.93.146.62.ssh > 99.225.113.199.51731: Flags [P.], seq 235487868:235488040, ack 132005, win 501, length 172
04:50:34.208728 IP 142.93.146.62.ssh > 99.225.113.199.51731: Flags [P.], seq 235488040:235488212, ack 132005, win 501, length 172
04:50:34.208827 IP 142.93.146.62.ssh > 99.225.113.199.51731: Flags [P.], seq 235488212:235488384, ack 132005, win 501, length 172
04:50:34.208914 IP 142.93.146.62.ssh > 99.225.113.199.51731: Flags [P.], seq 235488384:235488556, ack 132005, win 501, length 172
04:50:34.209009 IP 142.93.146.62.ssh > 99.225.113.199.51731: Flags [P.], seq 235488556:235488728, ack 132005, win 501, length 172
04:50:34.209102 IP 142.93.146.62.ssh > 99.225.113.199.51731: Flags [P.], seq 235488728:235488900, ack 132005, win 501, length 172
04:50:34.209198 IP 142.93.146.62.ssh > 99.225.113.199.51731: Flags [P.], seq 235488900:235489072, ack 132005, win 501, length 172
04:50:34.209306 IP 142.93.146.62.ssh > 99.225.113.199.51731: Flags [P.], seq 235489072:235489244, ack 132005, win 501, length 172
04:50:34.209403 IP 142.93.146.62.ssh > 99.225.113.199.51731: Flags [P.], seq 235489244:235489416, ack 132005, win 501, length 172
04:50:34.209494 IP 142.93.146.62.ssh > 99.225.113.199.51731: Flags [P.], seq 235489416:235489588, ack 132005, win 501, length 172
04:50:34.209595 IP 142.93.146.62.ssh > 99.225.113.199.51731: Flags [P.], seq 235489588:235489760, ack 132005, win 501, length 172
04:50:34.209685 IP 142.93.146.62.ssh > 99.225.113.199.51731: Flags [P.], seq 235489760:235489932, ack 132005, win 501, length 172
04:50:34.209782 IP 142.93.146.62.ssh > 99.225.113.199.51731: Flags [P.], seq 235489932:235490104, ack 132005, win 501, length 172
04:50:34.209889 IP 142.93.146.62.ssh > 99.225.113.199.51731: Flags [P.], seq 235490104:235490276, ack 132005, win 501, length 172
04:50:34.209990 IP 142.93.146.62.ssh > 99.225.113.199.51731: Flags [P.], seq 235490276:235490448, ack 132005, win 501, length 172
04:50:34.210092 IP 142.93.146.62.ssh > 99.225.113.199.51731: Flags [P.], seq 235490448:235490620, ack 132005, win 501, length 172
04:50:34.210190 IP 142.93.146.62.ssh > 99.225.113.199.51731: Flags [P.], seq 235490620:235490792, ack 132005, win 501, length 172
04:50:34.210283 IP 142.93.146.62.ssh > 99.225.113.199.51731: Flags [P.], seq 235490792:235490964, ack 132005, win 501, length 172
04:50:34.210379 IP 142.93.146.62.ssh > 99.225.113.199.51731: Flags [P.], seq 235490964:235491136, ack 132005, win 501, length 172
04:50:34.210483 IP 142.93.146.62.ssh > 99.225.113.199.51731: Flags [P.], seq 235491136:235491308, ack 132005, win 501, length 172
04:50:34.210576 IP 142.93.146.62.ssh > 99.225.113.199.51731: Flags [P.], seq 235491308:235491480, ack 132005, win 501, length 172
04:50:34.210697 IP 142.93.146.62.ssh > 99.225.113.199.51731: Flags [P.], seq 235491480:235491652, ack 132005, win 501, length 172
04:50:34.210796 IP 142.93.146.62.ssh > 99.225.113.199.51731: Flags [P.], seq 235491652:235491824, ack 132005, win 501, length 172
04:50:34.210879 IP 142.93.146.62.ssh > 99.225.113.199.51731: Flags [P.], seq 235491824:235491996, ack 132005, win 501, length 172
04:50:34.210909 IP 99.225.113.199.51731 > 142.93.146.62.ssh: Flags [.], ack 235471964, win 2087, length 0
04:50:34.210927 IP 99.225.113.199.51731 > 142.93.146.62.ssh: Flags [.], ack 235476092, win 2087, length 0
04:50:34.211031 IP 142.93.146.62.ssh > 99.225.113.199.51731: Flags [P.], seq 235491996:235492376, ack 132005, win 501, length 380
04:50:34.211134 IP 142.93.146.62.ssh > 99.225.113.199.51731: Flags [P.], seq 235492376:235492548, ack 132005, win 501, length 172
04:50:34.211220 IP 142.93.146.62.ssh > 99.225.113.199.51731: Flags [P.], seq 235492548:235492720, ack 132005, win 501, length 172
04:50:34.211303 IP 142.93.146.62.ssh > 99.225.113.199.51731: Flags [P.], seq 235492720:235492892, ack 132005, win 501, length 172
04:50:34.211383 IP 142.93.146.62.ssh > 99.225.113.199.51731: Flags [P.], seq 235492892:235493064, ack 132005, win 501, length 172
04:50:34.211470 IP 142.93.146.62.ssh > 99.225.113.199.51731: Flags [P.], seq 235493064:235493236, ack 132005, win 501, length 172
04:50:34.211552 IP 142.93.146.62.ssh > 99.225.113.199.51731: Flags [P.], seq 235493236:235493408, ack 132005, win 501, length 172
04:50:34.211634 IP 142.93.146.62.ssh > 99.225.113.199.51731: Flags [P.], seq 235493408:235493580, ack 132005, win 501, length 172
04:50:34.211715 IP 142.93.146.62.ssh > 99.225.113.199.51731: Flags [P.], seq 235493580:235493752, ack 132005, win 501, length 172
04:50:34.211803 IP 142.93.146.62.ssh > 99.225.113.199.51731: Flags [P.], seq 235493752:235493924, ack 132005, win 501, length 172
04:50:34.211888 IP 142.93.146.62.ssh > 99.225.113.199.51731: Flags [P.], seq 235493924:235494096, ack 132005, win 501, length 172
04:50:34.211968 IP 142.93.146.62.ssh > 99.225.113.199.51731: Flags [P.], seq 235494096:235494268, ack 132005, win 501, length 172
04:50:34.212053 IP 142.93.146.62.ssh > 99.225.113.199.51731: Flags [P.], seq 235494268:235494440, ack 132005, win 501, length 172
04:50:34.212135 IP 142.93.146.62.ssh > 99.225.113.199.51731: Flags [P.], seq 235494440:235494612, ack 132005, win 501, length 172
04:50:34.212221 IP 142.93.146.62.ssh > 99.225.113.199.51731: Flags [P.], seq 235494612:235494784, ack 132005, win 501, length 172
04:50:34.212321 IP 142.93.146.62.ssh > 99.225.113.199.51731: Flags [P.], seq 235494784:235494956, ack 132005, win 501, length 172
04:50:34.212408 IP 142.93.146.62.ssh > 99.225.113.199.51731: Flags [P.], seq 235494956:235495128, ack 132005, win 501, length 172
04:50:34.212490 IP 142.93.146.62.ssh > 99.225.113.199.51731: Flags [P.], seq 235495128:235495300, ack 132005, win 501, length 172
04:50:34.212573 IP 142.93.146.62.ssh > 99.225.113.199.51731: Flags [P.], seq 235495300:235495472, ack 132005, win 501, length 172
04:50:34.212660 IP 142.93.146.62.ssh > 99.225.113.199.51731: Flags [P.], seq 235495472:235495644, ack 132005, win 501, length 172
04:50:34.212742 IP 142.93.146.62.ssh > 99.225.113.199.51731: Flags [P.], seq 235495644:235495816, ack 132005, win 501, length 172
04:50:34.212823 IP 142.93.146.62.ssh > 99.225.113.199.51731: Flags [P.], seq 235495816:235495988, ack 132005, win 501, length 172
04:50:34.212910 IP 142.93.146.62.ssh > 99.225.113.199.51731: Flags [P.], seq 235495988:235496160, ack 132005, win 501, length 172
04:50:34.212991 IP 142.93.146.62.ssh > 99.225.113.199.51731: Flags [P.], seq 235496160:235496332, ack 132005, win 501, length 172
04:50:34.213077 IP 142.93.146.62.ssh > 99.225.113.199.51731: Flags [P.], seq 235496332:235496504, ack 132005, win 501, length 172
04:50:34.213158 IP 142.93.146.62.ssh > 99.225.113.199.51731: Flags [P.], seq 235496504:235496676, ack 132005, win 501, length 172
04:50:34.213248 IP 142.93.146.62.ssh > 99.225.113.199.51731: Flags [P.], seq 235496676:235496848, ack 132005, win 501, length 172
04:50:34.213336 IP 142.93.146.62.ssh > 99.225.113.199.51731: Flags [P.], seq 235496848:235497020, ack 132005, win 501, length 172
04:50:34.213418 IP 142.93.146.62.ssh > 99.225.113.199.51731: Flags [P.], seq 235497020:235497192, ack 132005, win 501, length 172
04:50:34.213502 IP 142.93.146.62.ssh > 99.225.113.199.51731: Flags [P.], seq 235497192:235497364, ack 132005, win 501, length 172
04:50:34.213588 IP 142.93.146.62.ssh > 99.225.113.199.51731: Flags [P.], seq 235497364:235497536, ack 132005, win 501, length 172
04:50:34.213671 IP 142.93.146.62.ssh > 99.225.113.199.51731: Flags [P.], seq 235497536:235497708, ack 132005, win 501, length 172
04:50:34.213759 IP 142.93.146.62.ssh > 99.225.113.199.51731: Flags [P.], seq 235497708:235497880, ack 132005, win 501, length 172
04:50:34.213846 IP 142.93.146.62.ssh > 99.225.113.199.51731: Flags [P.], seq 235497880:235498052, ack 132005, win 501, length 172
04:50:34.213951 IP 142.93.146.62.ssh > 99.225.113.199.51731: Flags [P.], seq 235498052:235498224, ack 132005, win 501, length 172
04:50:34.214043 IP 142.93.146.62.ssh > 99.225.113.199.51731: Flags [P.], seq 235498224:235498396, ack 132005, win 501, length 172
04:50:34.214125 IP 142.93.146.62.ssh > 99.225.113.199.51731: Flags [P.], seq 235498396:235498568, ack 132005, win 501, length 172
04:50:34.214216 IP 142.93.146.62.ssh > 99.225.113.199.51731: Flags [P.], seq 235498568:235498740, ack 132005, win 501, length 172
04:50:34.214300 IP 142.93.146.62.ssh > 99.225.113.199.51731: Flags [P.], seq 235498740:235498912, ack 132005, win 501, length 172
04:50:34.214387 IP 142.93.146.62.ssh > 99.225.113.199.51731: Flags [P.], seq 235498912:235499084, ack 132005, win 501, length 172
04:50:34.214469 IP 142.93.146.62.ssh > 99.225.113.199.51731: Flags [P.], seq 235499084:235499256, ack 132005, win 501, length 172
04:50:34.214550 IP 142.93.146.62.ssh > 99.225.113.199.51731: Flags [P.], seq 235499256:235499428, ack 132005, win 501, length 172
04:50:34.214635 IP 142.93.146.62.ssh > 99.225.113.199.51731: Flags [P.], seq 235499428:235499600, ack 132005, win 501, length 172
04:50:34.214727 IP 142.93.146.62.ssh > 99.225.113.199.51731: Flags [P.], seq 235499600:235499772, ack 132005, win 501, length 172
04:50:34.214816 IP 142.93.146.62.ssh > 99.225.113.199.51731: Flags [P.], seq 235499772:235499944, ack 132005, win 501, length 172
04:50:34.214902 IP 142.93.146.62.ssh > 99.225.113.199.51731: Flags [P.], seq 235499944:235500116, ack 132005, win 501, length 172
04:50:34.214985 IP 142.93.146.62.ssh > 99.225.113.199.51731: Flags [P.], seq 235500116:235500288, ack 132005, win 501, length 172
04:50:34.215090 IP 142.93.146.62.ssh > 99.225.113.199.51731: Flags [P.], seq 235500288:235500460, ack 132005, win 501, length 172
04:50:34.215172 IP 142.93.146.62.ssh > 99.225.113.199.51731: Flags [P.], seq 235500460:235500632, ack 132005, win 501, length 172
04:50:34.215253 IP 142.93.146.62.ssh > 99.225.113.199.51731: Flags [P.], seq 235500632:235500804, ack 132005, win 501, length 172
04:50:34.215382 IP 142.93.146.62.ssh > 99.225.113.199.51731: Flags [P.], seq 235500804:235500976, ack 132005, win 501, length 172
04:50:34.215499 IP 142.93.146.62.ssh > 99.225.113.199.51731: Flags [P.], seq 235500976:235501148, ack 132005, win 501, length 172
04:50:34.215589 IP 142.93.146.62.ssh > 99.225.113.199.51731: Flags [P.], seq 235501148:235501320, ack 132005, win 501, length 172
04:50:34.215678 IP 142.93.146.62.ssh > 99.225.113.199.51731: Flags [P.], seq 235501320:235501492, ack 132005, win 501, length 172
04:50:34.215763 IP 142.93.146.62.ssh > 99.225.113.199.51731: Flags [P.], seq 235501492:235501664, ack 132005, win 501, length 172
04:50:34.215851 IP 142.93.146.62.ssh > 99.225.113.199.51731: Flags [P.], seq 235501664:235501836, ack 132005, win 501, length 172
04:50:34.215934 IP 142.93.146.62.ssh > 99.225.113.199.51731: Flags [P.], seq 235501836:235502008, ack 132005, win 501, length 172
04:50:34.216056 IP 142.93.146.62.ssh > 99.225.113.199.51731: Flags [P.], seq 235502008:235502180, ack 132005, win 501, length 172
04:50:34.216151 IP 142.93.146.62.ssh > 99.225.113.199.51731: Flags [P.], seq 235502180:235502352, ack 132005, win 501, length 172
04:50:34.216235 IP 142.93.146.62.ssh > 99.225.113.199.51731: Flags [P.], seq 235502352:235502524, ack 132005, win 501, length 172
04:50:34.216336 IP 142.93.146.62.ssh > 99.225.113.199.51731: Flags [P.], seq 235502524:235502696, ack 132005, win 501, length 172
04:50:34.216471 IP 142.93.146.62.ssh > 99.225.113.199.51731: Flags [P.], seq 235502696:235502868, ack 132005, win 501, length 172
04:50:34.216573 IP 142.93.146.62.ssh > 99.225.113.199.51731: Flags [P.], seq 235502868:235503040, ack 132005, win 501, length 172
04:50:34.216657 IP 142.93.146.62.ssh > 99.225.113.199.51731: Flags [P.], seq 235503040:235503212, ack 132005, win 501, length 172
04:50:34.216743 IP 142.93.146.62.ssh > 99.225.113.199.51731: Flags [P.], seq 235503212:235503384, ack 132005, win 501, length 172
04:50:34.216824 IP 142.93.146.62.ssh > 99.225.113.199.51731: Flags [P.], seq 235503384:235503556, ack 132005, win 501, length 172
04:50:34.216908 IP 142.93.146.62.ssh > 99.225.113.199.51731: Flags [P.], seq 235503556:235503728, ack 132005, win 501, length 172
04:50:34.216996 IP 142.93.146.62.ssh > 99.225.113.199.51731: Flags [P.], seq 235503728:235503900, ack 132005, win 501, length 172
04:50:34.217121 IP 142.93.146.62.ssh > 99.225.113.199.51731: Flags [P.], seq 235503900:235504072, ack 132005, win 501, length 172
04:50:34.217231 IP 142.93.146.62.ssh > 99.225.113.199.51731: Flags [P.], seq 235504072:235504244, ack 132005, win 501, length 172
04:50:34.217320 IP 142.93.146.62.ssh > 99.225.113.199.51731: Flags [P.], seq 235504244:235504416, ack 132005, win 501, length 172
04:50:34.217403 IP 142.93.146.62.ssh > 99.225.113.199.51731: Flags [P.], seq 235504416:235504588, ack 132005, win 501, length 172
04:50:34.217600 IP 142.93.146.62.ssh > 99.225.113.199.51731: Flags [P.], seq 235504588:235504760, ack 132005, win 501, length 172
04:50:34.217693 IP 142.93.146.62.ssh > 99.225.113.199.51731: Flags [P.], seq 235504760:235504932, ack 132005, win 501, length 172
04:50:34.217780 IP 142.93.146.62.ssh > 99.225.113.199.51731: Flags [P.], seq 235504932:235505104, ack 132005, win 501, length 172
04:50:34.217875 IP 142.93.146.62.ssh > 99.225.113.199.51731: Flags [P.], seq 235505104:235505276, ack 132005, win 501, length 172
04:50:34.217959 IP 142.93.146.62.ssh > 99.225.113.199.51731: Flags [P.], seq 235505276:235505448, ack 132005, win 501, length 172
04:50:34.218048 IP 142.93.146.62.ssh > 99.225.113.199.51731: Flags [P.], seq 235505448:235505620, ack 132005, win 501, length 172
04:50:34.218133 IP 142.93.146.62.ssh > 99.225.113.199.51731: Flags [P.], seq 235505620:235505792, ack 132005, win 501, length 172
04:50:34.218215 IP 142.93.146.62.ssh > 99.225.113.199.51731: Flags [P.], seq 235505792:235505964, ack 132005, win 501, length 172
04:50:34.218303 IP 142.93.146.62.ssh > 99.225.113.199.51731: Flags [P.], seq 235505964:235506136, ack 132005, win 501, length 172
04:50:34.218385 IP 142.93.146.62.ssh > 99.225.113.199.51731: Flags [P.], seq 235506136:235506308, ack 132005, win 501, length 172
04:50:34.218470 IP 142.93.146.62.ssh > 99.225.113.199.51731: Flags [P.], seq 235506308:235506480, ack 132005, win 501, length 172
04:50:34.218563 IP 99.225.113.199.51731 > 142.93.146.62.ssh: Flags [.], ack 235482020, win 2087, length 0
04:50:34.218576 IP 99.225.113.199.51731 > 142.93.146.62.ssh: Flags [.], ack 235483568, win 2087, length 0
04:50:34.218579 IP 99.225.113.199.51731 > 142.93.146.62.ssh: Flags [P.], seq 132005:132041, ack 235483568, win 2087, length 36
04:50:34.218582 IP 99.225.113.199.51731 > 142.93.146.62.ssh: Flags [.], ack 235487868, win 2087, length 0
04:50:34.218587 IP 142.93.146.62.ssh > 99.225.113.199.51731: Flags [P.], seq 235506480:235506652, ack 132005, win 501, length 172
04:50:34.218768 IP 142.93.146.62.ssh > 99.225.113.199.51731: Flags [P.], seq 235506652:235507272, ack 132041, win 501, length 620
04:50:34.218865 IP 142.93.146.62.ssh > 99.225.113.199.51731: Flags [P.], seq 235507272:235507444, ack 132041, win 501, length 172
04:50:34.218955 IP 142.93.146.62.ssh > 99.225.113.199.51731: Flags [P.], seq 235507444:235507616, ack 132041, win 501, length 172
04:50:34.219043 IP 142.93.146.62.ssh > 99.225.113.199.51731: Flags [P.], seq 235507616:235507788, ack 132041, win 501, length 172
04:50:34.219147 IP 142.93.146.62.ssh > 99.225.113.199.51731: Flags [P.], seq 235507788:235507960, ack 132041, win 501, length 172
04:50:34.219230 IP 142.93.146.62.ssh > 99.225.113.199.51731: Flags [P.], seq 235507960:235508132, ack 132041, win 501, length 172
04:50:34.219313 IP 142.93.146.62.ssh > 99.225.113.199.51731: Flags [P.], seq 235508132:235508304, ack 132041, win 501, length 172
04:50:34.219395 IP 142.93.146.62.ssh > 99.225.113.199.51731: Flags [P.], seq 235508304:235508476, ack 132041, win 501, length 172
04:50:34.219483 IP 142.93.146.62.ssh > 99.225.113.199.51731: Flags [P.], seq 235508476:235508648, ack 132041, win 501, length 172
04:50:34.219567 IP 142.93.146.62.ssh > 99.225.113.199.51731: Flags [P.], seq 235508648:235508820, ack 132041, win 501, length 172
04:50:34.219649 IP 142.93.146.62.ssh > 99.225.113.199.51731: Flags [P.], seq 235508820:235508992, ack 132041, win 501, length 172
04:50:34.219738 IP 142.93.146.62.ssh > 99.225.113.199.51731: Flags [P.], seq 235508992:235509164, ack 132041, win 501, length 172
04:50:34.219821 IP 142.93.146.62.ssh > 99.225.113.199.51731: Flags [P.], seq 235509164:235509336, ack 132041, win 501, length 172
04:50:34.219908 IP 142.93.146.62.ssh > 99.225.113.199.51731: Flags [P.], seq 235509336:235509508, ack 132041, win 501, length 172
04:50:34.219992 IP 142.93.146.62.ssh > 99.225.113.199.51731: Flags [P.], seq 235509508:235509680, ack 132041, win 501, length 172
04:50:34.220073 IP 142.93.146.62.ssh > 99.225.113.199.51731: Flags [P.], seq 235509680:235509852, ack 132041, win 501, length 172
04:50:34.220157 IP 142.93.146.62.ssh > 99.225.113.199.51731: Flags [P.], seq 235509852:235510024, ack 132041, win 501, length 172
04:50:34.220253 IP 142.93.146.62.ssh > 99.225.113.199.51731: Flags [P.], seq 235510024:235510196, ack 132041, win 501, length 172
04:50:34.220380 IP 142.93.146.62.ssh > 99.225.113.199.51731: Flags [P.], seq 235510196:235510368, ack 132041, win 501, length 172
04:50:34.220496 IP 142.93.146.62.ssh > 99.225.113.199.51731: Flags [P.], seq 235510368:235510540, ack 132041, win 501, length 172
04:50:34.220589 IP 142.93.146.62.ssh > 99.225.113.199.51731: Flags [P.], seq 235510540:235510712, ack 132041, win 501, length 172
04:50:34.220678 IP 142.93.146.62.ssh > 99.225.113.199.51731: Flags [P.], seq 235510712:235510884, ack 132041, win 501, length 172
04:50:34.220761 IP 142.93.146.62.ssh > 99.225.113.199.51731: Flags [P.], seq 235510884:235511056, ack 132041, win 501, length 172
04:50:34.220850 IP 142.93.146.62.ssh > 99.225.113.199.51731: Flags [P.], seq 235511056:235511228, ack 132041, win 501, length 172
04:50:34.220933 IP 142.93.146.62.ssh > 99.225.113.199.51731: Flags [P.], seq 235511228:235511400, ack 132041, win 501, length 172
04:50:34.221016 IP 142.93.146.62.ssh > 99.225.113.199.51731: Flags [P.], seq 235511400:235511572, ack 132041, win 501, length 172
04:50:34.221111 IP 142.93.146.62.ssh > 99.225.113.199.51731: Flags [P.], seq 235511572:235511744, ack 132041, win 501, length 172
04:50:34.221206 IP 142.93.146.62.ssh > 99.225.113.199.51731: Flags [P.], seq 235511744:235511916, ack 132041, win 501, length 172
04:50:34.221289 IP 142.93.146.62.ssh > 99.225.113.199.51731: Flags [P.], seq 235511916:235512088, ack 132041, win 501, length 172
04:50:34.221380 IP 142.93.146.62.ssh > 99.225.113.199.51731: Flags [P.], seq 235512088:235512260, ack 132041, win 501, length 172
04:50:34.221516 IP 142.93.146.62.ssh > 99.225.113.199.51731: Flags [P.], seq 235512260:235512432, ack 132041, win 501, length 172
04:50:34.221620 IP 142.93.146.62.ssh > 99.225.113.199.51731: Flags [P.], seq 235512432:235512604, ack 132041, win 501, length 172
04:50:34.221710 IP 142.93.146.62.ssh > 99.225.113.199.51731: Flags [P.], seq 235512604:235512776, ack 132041, win 501, length 172
04:50:34.221803 IP 142.93.146.62.ssh > 99.225.113.199.51731: Flags [P.], seq 235512776:235512948, ack 132041, win 501, length 172
04:50:34.221891 IP 142.93.146.62.ssh > 99.225.113.199.51731: Flags [P.], seq 235512948:235513120, ack 132041, win 501, length 172
04:50:34.221973 IP 142.93.146.62.ssh > 99.225.113.199.51731: Flags [P.], seq 235513120:235513292, ack 132041, win 501, length 172
04:50:34.222057 IP 142.93.146.62.ssh > 99.225.113.199.51731: Flags [P.], seq 235513292:235513464, ack 132041, win 501, length 172
04:50:34.222141 IP 142.93.146.62.ssh > 99.225.113.199.51731: Flags [P.], seq 235513464:235513636, ack 132041, win 501, length 172
04:50:34.222230 IP 142.93.146.62.ssh > 99.225.113.199.51731: Flags [P.], seq 235513636:235513808, ack 132041, win 501, length 172
04:50:34.222313 IP 142.93.146.62.ssh > 99.225.113.199.51731: Flags [P.], seq 235513808:235513980, ack 132041, win 501, length 172
04:50:34.222399 IP 142.93.146.62.ssh > 99.225.113.199.51731: Flags [P.], seq 235513980:235514152, ack 132041, win 501, length 172
04:50:34.222519 IP 142.93.146.62.ssh > 99.225.113.199.51731: Flags [P.], seq 235514152:235514324, ack 132041, win 501, length 172
04:50:34.222641 IP 142.93.146.62.ssh > 99.225.113.199.51731: Flags [P.], seq 235514324:235514496, ack 132041, win 501, length 172
04:50:34.222756 IP 142.93.146.62.ssh > 99.225.113.199.51731: Flags [P.], seq 235514496:235514668, ack 132041, win 501, length 172
04:50:34.222862 IP 142.93.146.62.ssh > 99.225.113.199.51731: Flags [P.], seq 235514668:235514840, ack 132041, win 501, length 172
04:50:34.222974 IP 142.93.146.62.ssh > 99.225.113.199.51731: Flags [P.], seq 235514840:235515012, ack 132041, win 501, length 172
04:50:34.223101 IP 142.93.146.62.ssh > 99.225.113.199.51731: Flags [P.], seq 235515012:235515184, ack 132041, win 501, length 172
04:50:34.223205 IP 142.93.146.62.ssh > 99.225.113.199.51731: Flags [P.], seq 235515184:235515356, ack 132041, win 501, length 172
04:50:34.223336 IP 142.93.146.62.ssh > 99.225.113.199.51731: Flags [P.], seq 235515356:235515528, ack 132041, win 501, length 172
04:50:34.223474 IP 142.93.146.62.ssh > 99.225.113.199.51731: Flags [P.], seq 235515528:235515700, ack 132041, win 501, length 172
04:50:34.223574 IP 142.93.146.62.ssh > 99.225.113.199.51731: Flags [P.], seq 235515700:235515872, ack 132041, win 501, length 172
04:50:34.223668 IP 142.93.146.62.ssh > 99.225.113.199.51731: Flags [P.], seq 235515872:235516044, ack 132041, win 501, length 172
04:50:34.223759 IP 142.93.146.62.ssh > 99.225.113.199.51731: Flags [P.], seq 235516044:235516216, ack 132041, win 501, length 172
04:50:34.223842 IP 142.93.146.62.ssh > 99.225.113.199.51731: Flags [P.], seq 235516216:235516388, ack 132041, win 501, length 172
04:50:34.223930 IP 142.93.146.62.ssh > 99.225.113.199.51731: Flags [P.], seq 235516388:235516560, ack 132041, win 501, length 172
04:50:34.224013 IP 142.93.146.62.ssh > 99.225.113.199.51731: Flags [P.], seq 235516560:235516732, ack 132041, win 501, length 172
04:50:34.224095 IP 142.93.146.62.ssh > 99.225.113.199.51731: Flags [P.], seq 235516732:235516904, ack 132041, win 501, length 172
04:50:34.224183 IP 142.93.146.62.ssh > 99.225.113.199.51731: Flags [P.], seq 235516904:235517076, ack 132041, win 501, length 172
04:50:34.224283 IP 142.93.146.62.ssh > 99.225.113.199.51731: Flags [P.], seq 235517076:235517248, ack 132041, win 501, length 172
04:50:34.224377 IP 142.93.146.62.ssh > 99.225.113.199.51731: Flags [P.], seq 235517248:235517420, ack 132041, win 501, length 172
04:50:34.224466 IP 142.93.146.62.ssh > 99.225.113.199.51731: Flags [P.], seq 235517420:235517592, ack 132041, win 501, length 172
04:50:34.224547 IP 142.93.146.62.ssh > 99.225.113.199.51731: Flags [P.], seq 235517592:235517764, ack 132041, win 501, length 172
04:50:34.224632 IP 142.93.146.62.ssh > 99.225.113.199.51731: Flags [P.], seq 235517764:235517936, ack 132041, win 501, length 172
04:50:34.224719 IP 142.93.146.62.ssh > 99.225.113.199.51731: Flags [P.], seq 235517936:235518108, ack 132041, win 501, length 172
04:50:34.224801 IP 142.93.146.62.ssh > 99.225.113.199.51731: Flags [P.], seq 235518108:235518280, ack 132041, win 501, length 172
04:50:34.224886 IP 142.93.146.62.ssh > 99.225.113.199.51731: Flags [P.], seq 235518280:235518452, ack 132041, win 501, length 172
04:50:34.224973 IP 142.93.146.62.ssh > 99.225.113.199.51731: Flags [P.], seq 235518452:235518624, ack 132041, win 501, length 172
04:50:34.225059 IP 142.93.146.62.ssh > 99.225.113.199.51731: Flags [P.], seq 235518624:235518796, ack 132041, win 501, length 172
04:50:34.225146 IP 142.93.146.62.ssh > 99.225.113.199.51731: Flags [P.], seq 235518796:235518968, ack 132041, win 501, length 172
04:50:34.225233 IP 142.93.146.62.ssh > 99.225.113.199.51731: Flags [P.], seq 235518968:235519140, ack 132041, win 501, length 172
04:50:34.225314 IP 142.93.146.62.ssh > 99.225.113.199.51731: Flags [P.], seq 235519140:235519312, ack 132041, win 501, length 172
04:50:34.225401 IP 142.93.146.62.ssh > 99.225.113.199.51731: Flags [P.], seq 235519312:235519484, ack 132041, win 501, length 172
04:50:34.225530 IP 142.93.146.62.ssh > 99.225.113.199.51731: Flags [P.], seq 235519484:235519656, ack 132041, win 501, length 172
04:50:34.225629 IP 142.93.146.62.ssh > 99.225.113.199.51731: Flags [P.], seq 235519656:235519828, ack 132041, win 501, length 172
04:50:34.225713 IP 142.93.146.62.ssh > 99.225.113.199.51731: Flags [P.], seq 235519828:235520000, ack 132041, win 501, length 172
04:50:34.225801 IP 142.93.146.62.ssh > 99.225.113.199.51731: Flags [P.], seq 235520000:235520172, ack 132041, win 501, length 172
04:50:34.225893 IP 142.93.146.62.ssh > 99.225.113.199.51731: Flags [P.], seq 235520172:235520344, ack 132041, win 501, length 172
04:50:34.225980 IP 142.93.146.62.ssh > 99.225.113.199.51731: Flags [P.], seq 235520344:235520516, ack 132041, win 501, length 172
04:50:34.226063 IP 142.93.146.62.ssh > 99.225.113.199.51731: Flags [P.], seq 235520516:235520688, ack 132041, win 501, length 172
04:50:34.226149 IP 142.93.146.62.ssh > 99.225.113.199.51731: Flags [P.], seq 235520688:235520860, ack 132041, win 501, length 172
04:50:34.226233 IP 142.93.146.62.ssh > 99.225.113.199.51731: Flags [P.], seq 235520860:235521032, ack 132041, win 501, length 172
04:50:34.226317 IP 142.93.146.62.ssh > 99.225.113.199.51731: Flags [P.], seq 235521032:235521204, ack 132041, win 501, length 172
04:50:34.226403 IP 142.93.146.62.ssh > 99.225.113.199.51731: Flags [P.], seq 235521204:235521376, ack 132041, win 501, length 172
04:50:34.226490 IP 142.93.146.62.ssh > 99.225.113.199.51731: Flags [P.], seq 235521376:235521548, ack 132041, win 501, length 172
04:50:34.226576 IP 142.93.146.62.ssh > 99.225.113.199.51731: Flags [P.], seq 235521548:235521720, ack 132041, win 501, length 172
04:50:34.226663 IP 142.93.146.62.ssh > 99.225.113.199.51731: Flags [P.], seq 235521720:235521892, ack 132041, win 501, length 172
04:50:34.226745 IP 142.93.146.62.ssh > 99.225.113.199.51731: Flags [P.], seq 235521892:235522064, ack 132041, win 501, length 172
04:50:34.226829 IP 142.93.146.62.ssh > 99.225.113.199.51731: Flags [P.], seq 235522064:235522236, ack 132041, win 501, length 172
04:50:34.226916 IP 142.93.146.62.ssh > 99.225.113.199.51731: Flags [P.], seq 235522236:235522408, ack 132041, win 501, length 172
04:50:34.227002 IP 142.93.146.62.ssh > 99.225.113.199.51731: Flags [P.], seq 235522408:235522580, ack 132041, win 501, length 172
04:50:34.227114 IP 142.93.146.62.ssh > 99.225.113.199.51731: Flags [P.], seq 235522580:235522752, ack 132041, win 501, length 172
04:50:34.227207 IP 142.93.146.62.ssh > 99.225.113.199.51731: Flags [P.], seq 235522752:235522924, ack 132041, win 501, length 172
04:50:34.227296 IP 142.93.146.62.ssh > 99.225.113.199.51731: Flags [P.], seq 235522924:235523096, ack 132041, win 501, length 172
04:50:34.227397 IP 142.93.146.62.ssh > 99.225.113.199.51731: Flags [P.], seq 235523096:235523268, ack 132041, win 501, length 172
04:50:34.227510 IP 142.93.146.62.ssh > 99.225.113.199.51731: Flags [P.], seq 235523268:235523440, ack 132041, win 501, length 172
04:50:34.227599 IP 142.93.146.62.ssh > 99.225.113.199.51731: Flags [P.], seq 235523440:235523612, ack 132041, win 501, length 172
04:50:34.227690 IP 142.93.146.62.ssh > 99.225.113.199.51731: Flags [P.], seq 235523612:235523784, ack 132041, win 501, length 172
04:50:34.227776 IP 142.93.146.62.ssh > 99.225.113.199.51731: Flags [P.], seq 235523784:235523956, ack 132041, win 501, length 172
04:50:34.227859 IP 142.93.146.62.ssh > 99.225.113.199.51731: Flags [P.], seq 235523956:235524128, ack 132041, win 501, length 172
04:50:34.227951 IP 142.93.146.62.ssh > 99.225.113.199.51731: Flags [P.], seq 235524128:235524300, ack 132041, win 501, length 172
04:50:34.228036 IP 142.93.146.62.ssh > 99.225.113.199.51731: Flags [P.], seq 235524300:235524472, ack 132041, win 501, length 172
04:50:34.228125 IP 142.93.146.62.ssh > 99.225.113.199.51731: Flags [P.], seq 235524472:235524644, ack 132041, win 501, length 172
04:50:34.228207 IP 142.93.146.62.ssh > 99.225.113.199.51731: Flags [P.], seq 235524644:235524816, ack 132041, win 501, length 172
04:50:34.228305 IP 142.93.146.62.ssh > 99.225.113.199.51731: Flags [P.], seq 235524816:235524988, ack 132041, win 501, length 172
04:50:34.228399 IP 142.93.146.62.ssh > 99.225.113.199.51731: Flags [P.], seq 235524988:235525160, ack 132041, win 501, length 172
04:50:34.228483 IP 142.93.146.62.ssh > 99.225.113.199.51731: Flags [P.], seq 235525160:235525332, ack 132041, win 501, length 172
04:50:34.228579 IP 142.93.146.62.ssh > 99.225.113.199.51731: Flags [P.], seq 235525332:235525504, ack 132041, win 501, length 172
04:50:34.228664 IP 142.93.146.62.ssh > 99.225.113.199.51731: Flags [P.], seq 235525504:235525676, ack 132041, win 501, length 172
04:50:34.228748 IP 142.93.146.62.ssh > 99.225.113.199.51731: Flags [P.], seq 235525676:235525848, ack 132041, win 501, length 172
04:50:34.228957 IP 142.93.146.62.ssh > 99.225.113.199.51731: Flags [P.], seq 235525848:235526020, ack 132041, win 501, length 172
04:50:34.229047 IP 142.93.146.62.ssh > 99.225.113.199.51731: Flags [P.], seq 235526020:235526192, ack 132041, win 501, length 172
04:50:34.229131 IP 142.93.146.62.ssh > 99.225.113.199.51731: Flags [P.], seq 235526192:235526364, ack 132041, win 501, length 172
04:50:34.229218 IP 142.93.146.62.ssh > 99.225.113.199.51731: Flags [P.], seq 235526364:235526536, ack 132041, win 501, length 172
04:50:34.229306 IP 142.93.146.62.ssh > 99.225.113.199.51731: Flags [P.], seq 235526536:235526708, ack 132041, win 501, length 172
04:50:34.229414 IP 142.93.146.62.ssh > 99.225.113.199.51731: Flags [P.], seq 235526708:235526880, ack 132041, win 501, length 172
04:50:34.229531 IP 142.93.146.62.ssh > 99.225.113.199.51731: Flags [P.], seq 235526880:235527052, ack 132041, win 501, length 172
04:50:34.229617 IP 142.93.146.62.ssh > 99.225.113.199.51731: Flags [P.], seq 235527052:235527224, ack 132041, win 501, length 172
04:50:34.229699 IP 142.93.146.62.ssh > 99.225.113.199.51731: Flags [P.], seq 235527224:235527396, ack 132041, win 501, length 172
04:50:34.229783 IP 142.93.146.62.ssh > 99.225.113.199.51731: Flags [P.], seq 235527396:235527568, ack 132041, win 501, length 172
04:50:34.229866 IP 142.93.146.62.ssh > 99.225.113.199.51731: Flags [P.], seq 235527568:235527740, ack 132041, win 501, length 172
04:50:34.229950 IP 142.93.146.62.ssh > 99.225.113.199.51731: Flags [P.], seq 235527740:235527912, ack 132041, win 501, length 172
04:50:34.230033 IP 142.93.146.62.ssh > 99.225.113.199.51731: Flags [P.], seq 235527912:235528084, ack 132041, win 501, length 172
04:50:34.230115 IP 142.93.146.62.ssh > 99.225.113.199.51731: Flags [P.], seq 235528084:235528256, ack 132041, win 501, length 172
04:50:34.230207 IP 142.93.146.62.ssh > 99.225.113.199.51731: Flags [P.], seq 235528256:235528428, ack 132041, win 501, length 172
04:50:34.230291 IP 142.93.146.62.ssh > 99.225.113.199.51731: Flags [P.], seq 235528428:235528600, ack 132041, win 501, length 172
04:50:34.230378 IP 142.93.146.62.ssh > 99.225.113.199.51731: Flags [P.], seq 235528600:235528772, ack 132041, win 501, length 172
04:50:34.230501 IP 142.93.146.62.ssh > 99.225.113.199.51731: Flags [P.], seq 235528772:235528944, ack 132041, win 501, length 172
04:50:34.230596 IP 142.93.146.62.ssh > 99.225.113.199.51731: Flags [P.], seq 235528944:235529116, ack 132041, win 501, length 172
04:50:34.230690 IP 142.93.146.62.ssh > 99.225.113.199.51731: Flags [P.], seq 235529116:235529288, ack 132041, win 501, length 172
04:50:34.230775 IP 142.93.146.62.ssh > 99.225.113.199.51731: Flags [P.], seq 235529288:235529460, ack 132041, win 501, length 172
04:50:34.230873 IP 142.93.146.62.ssh > 99.225.113.199.51731: Flags [P.], seq 235529460:235529632, ack 132041, win 501, length 172
04:50:34.230961 IP 142.93.146.62.ssh > 99.225.113.199.51731: Flags [P.], seq 235529632:235529804, ack 132041, win 501, length 172
04:50:34.231045 IP 142.93.146.62.ssh > 99.225.113.199.51731: Flags [P.], seq 235529804:235529976, ack 132041, win 501, length 172
04:50:34.231157 IP 142.93.146.62.ssh > 99.225.113.199.51731: Flags [P.], seq 235529976:235530148, ack 132041, win 501, length 172
04:50:34.231241 IP 142.93.146.62.ssh > 99.225.113.199.51731: Flags [P.], seq 235530148:235530320, ack 132041, win 501, length 172
04:50:34.231323 IP 142.93.146.62.ssh > 99.225.113.199.51731: Flags [P.], seq 235530320:235530492, ack 132041, win 501, length 172
04:50:34.231430 IP 142.93.146.62.ssh > 99.225.113.199.51731: Flags [P.], seq 235530492:235530664, ack 132041, win 501, length 172
04:50:34.231543 IP 142.93.146.62.ssh > 99.225.113.199.51731: Flags [P.], seq 235530664:235530836, ack 132041, win 501, length 172
04:50:34.231639 IP 142.93.146.62.ssh > 99.225.113.199.51731: Flags [P.], seq 235530836:235531008, ack 132041, win 501, length 172
04:50:34.231755 IP 142.93.146.62.ssh > 99.225.113.199.51731: Flags [P.], seq 235531008:235531180, ack 132041, win 501, length 172
04:50:34.231851 IP 142.93.146.62.ssh > 99.225.113.199.51731: Flags [P.], seq 235531180:235531352, ack 132041, win 501, length 172
04:50:34.231938 IP 142.93.146.62.ssh > 99.225.113.199.51731: Flags [P.], seq 235531352:235531524, ack 132041, win 501, length 172
04:50:34.232020 IP 142.93.146.62.ssh > 99.225.113.199.51731: Flags [P.], seq 235531524:235531696, ack 132041, win 501, length 172
04:50:34.232125 IP 142.93.146.62.ssh > 99.225.113.199.51731: Flags [P.], seq 235531696:235531868, ack 132041, win 501, length 172
04:50:34.232219 IP 142.93.146.62.ssh > 99.225.113.199.51731: Flags [P.], seq 235531868:235532040, ack 132041, win 501, length 172
04:50:34.232318 IP 142.93.146.62.ssh > 99.225.113.199.51731: Flags [P.], seq 235532040:235532212, ack 132041, win 501, length 172
04:50:34.232408 IP 142.93.146.62.ssh > 99.225.113.199.51731: Flags [P.], seq 235532212:235532384, ack 132041, win 501, length 172
04:50:34.232526 IP 142.93.146.62.ssh > 99.225.113.199.51731: Flags [P.], seq 235532384:235532556, ack 132041, win 501, length 172
04:50:34.232635 IP 142.93.146.62.ssh > 99.225.113.199.51731: Flags [P.], seq 235532556:235532728, ack 132041, win 501, length 172
04:50:34.232726 IP 142.93.146.62.ssh > 99.225.113.199.51731: Flags [P.], seq 235532728:235532900, ack 132041, win 501, length 172
04:50:34.232826 IP 142.93.146.62.ssh > 99.225.113.199.51731: Flags [P.], seq 235532900:235533072, ack 132041, win 501, length 172
04:50:34.232911 IP 142.93.146.62.ssh > 99.225.113.199.51731: Flags [P.], seq 235533072:235533244, ack 132041, win 501, length 172
04:50:34.233009 IP 142.93.146.62.ssh > 99.225.113.199.51731: Flags [P.], seq 235533244:235533416, ack 132041, win 501, length 172
04:50:34.233113 IP 142.93.146.62.ssh > 99.225.113.199.51731: Flags [P.], seq 235533416:235533588, ack 132041, win 501, length 172
04:50:34.233218 IP 142.93.146.62.ssh > 99.225.113.199.51731: Flags [P.], seq 235533588:235533760, ack 132041, win 501, length 172
04:50:34.233323 IP 142.93.146.62.ssh > 99.225.113.199.51731: Flags [P.], seq 235533760:235533932, ack 132041, win 501, length 172
04:50:34.233418 IP 142.93.146.62.ssh > 99.225.113.199.51731: Flags [P.], seq 235533932:235534104, ack 132041, win 501, length 172
04:50:34.233508 IP 142.93.146.62.ssh > 99.225.113.199.51731: Flags [P.], seq 235534104:235534276, ack 132041, win 501, length 172
04:50:34.233607 IP 142.93.146.62.ssh > 99.225.113.199.51731: Flags [P.], seq 235534276:235534448, ack 132041, win 501, length 172
04:50:34.233711 IP 142.93.146.62.ssh > 99.225.113.199.51731: Flags [P.], seq 235534448:235534620, ack 132041, win 501, length 172
04:50:34.233810 IP 142.93.146.62.ssh > 99.225.113.199.51731: Flags [P.], seq 235534620:235534792, ack 132041, win 501, length 172
04:50:34.233917 IP 142.93.146.62.ssh > 99.225.113.199.51731: Flags [P.], seq 235534792:235534964, ack 132041, win 501, length 172
04:50:34.234012 IP 142.93.146.62.ssh > 99.225.113.199.51731: Flags [P.], seq 235534964:235535136, ack 132041, win 501, length 172
04:50:34.234106 IP 142.93.146.62.ssh > 99.225.113.199.51731: Flags [P.], seq 235535136:235535308, ack 132041, win 501, length 172
04:50:34.234191 IP 142.93.146.62.ssh > 99.225.113.199.51731: Flags [P.], seq 235535308:235535480, ack 132041, win 501, length 172
04:50:34.234290 IP 142.93.146.62.ssh > 99.225.113.199.51731: Flags [P.], seq 235535480:235535652, ack 132041, win 501, length 172
04:50:34.234384 IP 142.93.146.62.ssh > 99.225.113.199.51731: Flags [P.], seq 235535652:235535824, ack 132041, win 501, length 172
04:50:34.234455 IP 99.225.113.199.51731 > 142.93.146.62.ssh: Flags [.], ack 235493580, win 2087, length 0
04:50:34.234497 IP 99.225.113.199.51731 > 142.93.146.62.ssh: Flags [.], ack 235499084, win 2087, length 0
04:50:34.234522 IP 99.225.113.199.51731 > 142.93.146.62.ssh: Flags [.], ack 235499428, win 2086, length 0
04:50:34.234527 IP 99.225.113.199.51731 > 142.93.146.62.ssh: Flags [.], ack 235503556, win 2087, length 0
04:50:34.234541 IP 99.225.113.199.51731 > 142.93.146.62.ssh: Flags [.], ack 235507616, win 2087, length 0
04:50:34.234555 IP 99.225.113.199.51731 > 142.93.146.62.ssh: Flags [.], ack 235511744, win 2087, length 0
